{
  "version": 3,
  "command": "prove-corpus",
  "ok": false,
  "failed_phase": "corpus.emit_c",
  "failure": {
    "phase": "corpus.emit_c",
    "corpus_id": "hello",
    "artifact_path": ""
  },
  "phases": [
    {
      "id": "selfhost.copy",
      "group": "selfhost",
      "ordinal": 1,
      "status": "skipped",
      "artifact": null
    },
    {
      "id": "selfhost.stage1_emit_c",
      "group": "selfhost",
      "ordinal": 2,
      "status": "skipped",
      "artifact": null
    },
    {
      "id": "selfhost.stage2_run",
      "group": "selfhost",
      "ordinal": 3,
      "status": "skipped",
      "artifact": null
    },
    {
      "id": "selfhost.structural_c_compare",
      "group": "selfhost",
      "ordinal": 4,
      "status": "skipped",
      "artifact": null
    },
    {
      "id": "corpus.emit_c",
      "group": "corpus",
      "ordinal": 5,
      "status": "failed",
      "artifact": null
    },
    {
      "id": "corpus.build",
      "group": "corpus",
      "ordinal": 6,
      "status": "skipped",
      "artifact": null
    },
    {
      "id": "corpus.run",
      "group": "corpus",
      "ordinal": 7,
      "status": "skipped",
      "artifact": null
    },
    {
      "id": "corpus.structural_c_compare",
      "group": "corpus",
      "ordinal": 8,
      "status": "skipped",
      "artifact": null
    },
    {
      "id": "tooling.schema_golden",
      "group": "tooling",
      "ordinal": 9,
      "status": "skipped",
      "artifact": null
    },
    {
      "id": "tooling.policy_check",
      "group": "tooling",
      "ordinal": 10,
      "status": "skipped",
      "artifact": null
    },
    {
      "id": "tooling.refactor_plan",
      "group": "tooling",
      "ordinal": 11,
      "status": "skipped",
      "artifact": null
    },
    {
      "id": "tooling.formatter_check",
      "group": "tooling",
      "ordinal": 12,
      "status": "skipped",
      "artifact": null
    }
  ],
  "selfhost": {
    "status": "skipped",
    "structural_c_equal": null,
    "artifacts": {
      "workspace_main": null,
      "stage1_c": null,
      "stage2_c": null
    }
  },
  "corpus": {
    "status": "failed",
    "cases": 1,
    "ids": [
      "hello"
    ],
    "artifacts": [
      {
        "id": "hello",
        "source": "examples/hello.nq",
        "emit_c": null,
        "build_c": null,
        "run_c": null
      }
    ]
  },
  "tooling": {
    "status": "skipped",
    "groups": [
      "schema_golden",
      "policy_check",
      "refactor_plan",
      "formatter_check"
    ]
  }
}
