{
  "version": 3,
  "command": "prove-selfhost",
  "ok": true,
  "failed_phase": "",
  "failure": {
    "phase": "",
    "corpus_id": "",
    "artifact_path": ""
  },
  "phases": [
    {
      "id": "selfhost.copy",
      "group": "selfhost",
      "ordinal": 1,
      "status": "passed",
      "artifact": {
        "path": "build/proof/selfhost/main.nq",
        "hash": {
          "algorithm": "sha256",
          "value": "ba7816bf8f01cfea414140de5dae2223b00361a396177a9cb410ff61f20015ad"
        }
      }
    },
    {
      "id": "selfhost.stage1_emit_c",
      "group": "selfhost",
      "ordinal": 2,
      "status": "passed",
      "artifact": {
        "path": "build/proof/selfhost/build/stage1.main.c",
        "hash": {
          "algorithm": "sha256",
          "value": "ba7816bf8f01cfea414140de5dae2223b00361a396177a9cb410ff61f20015ad"
        }
      }
    },
    {
      "id": "selfhost.stage2_run",
      "group": "selfhost",
      "ordinal": 3,
      "status": "passed",
      "artifact": {
        "path": "build/proof/selfhost/build/stage2.main.c",
        "hash": {
          "algorithm": "sha256",
          "value": "ba7816bf8f01cfea414140de5dae2223b00361a396177a9cb410ff61f20015ad"
        }
      }
    },
    {
      "id": "selfhost.structural_c_compare",
      "group": "selfhost",
      "ordinal": 4,
      "status": "passed",
      "artifact": {
        "path": "build/proof/selfhost/build/stage2.main.c",
        "hash": {
          "algorithm": "sha256",
          "value": "ba7816bf8f01cfea414140de5dae2223b00361a396177a9cb410ff61f20015ad"
        }
      }
    },
    {
      "id": "corpus.emit_c",
      "group": "corpus",
      "ordinal": 5,
      "status": "skipped",
      "artifact": null
    },
    {
      "id": "corpus.build",
      "group": "corpus",
      "ordinal": 6,
      "status": "skipped",
      "artifact": null
    },
    {
      "id": "corpus.run",
      "group": "corpus",
      "ordinal": 7,
      "status": "skipped",
      "artifact": null
    },
    {
      "id": "corpus.structural_c_compare",
      "group": "corpus",
      "ordinal": 8,
      "status": "skipped",
      "artifact": null
    },
    {
      "id": "tooling.schema_golden",
      "group": "tooling",
      "ordinal": 9,
      "status": "skipped",
      "artifact": null
    },
    {
      "id": "tooling.policy_check",
      "group": "tooling",
      "ordinal": 10,
      "status": "skipped",
      "artifact": null
    },
    {
      "id": "tooling.refactor_plan",
      "group": "tooling",
      "ordinal": 11,
      "status": "skipped",
      "artifact": null
    },
    {
      "id": "tooling.formatter_check",
      "group": "tooling",
      "ordinal": 12,
      "status": "skipped",
      "artifact": null
    }
  ],
  "selfhost": {
    "status": "passed",
    "structural_c_equal": true,
    "artifacts": {
      "workspace_main": {
        "path": "build/proof/selfhost/main.nq",
        "hash": {
          "algorithm": "sha256",
          "value": "ba7816bf8f01cfea414140de5dae2223b00361a396177a9cb410ff61f20015ad"
        }
      },
      "stage1_c": {
        "path": "build/proof/selfhost/build/stage1.main.c",
        "hash": {
          "algorithm": "sha256",
          "value": "ba7816bf8f01cfea414140de5dae2223b00361a396177a9cb410ff61f20015ad"
        }
      },
      "stage2_c": {
        "path": "build/proof/selfhost/build/stage2.main.c",
        "hash": {
          "algorithm": "sha256",
          "value": "ba7816bf8f01cfea414140de5dae2223b00361a396177a9cb410ff61f20015ad"
        }
      }
    }
  },
  "corpus": {
    "status": "skipped",
    "cases": 0,
    "ids": [],
    "artifacts": []
  },
  "tooling": {
    "status": "skipped",
    "groups": [
      "schema_golden",
      "policy_check",
      "refactor_plan",
      "formatter_check"
    ]
  }
}
